{
  "schema_version": "papers-decisions/v1",
  "prepared_on": "2026-10-22",
  "policy": "An engineering baseline is a documented preparation decision, not evidence of a different-account approval, legal clearance, team appointment or accepting owner.",
  "decisions": [
    {
      "id": "PAPER-DEC-001",
      "question": "How should the incomplete pasted epic list be completed?",
      "decision": "Retain all eight supplied Epic 01 packages and four supplied Epic 02 names; complete 02.05 as Conference and venue metadata. Infer the remaining 20-epic, 144-package scope from the explicit mission, existing standards and scientific-directory boundaries.",
      "alternatives": [
        "Stop after the truncated 02.05 list",
        "Treat unseen epic text as if it had been supplied"
      ],
      "status": "Engineering Baseline Adopted",
      "decision_role": "Program maintainer and affected receiving owner",
      "rationale": "Preserve traceability, existing ownership and explicit unknowns while providing a concrete implementation/research foundation.",
      "affects": [
        "PAPER-01.01",
        "PAPER-02.05",
        "PAPER-20.07"
      ],
      "evidence": [
        {
          "title": "Parent coverage audit #509",
          "url": "https://github.com/Pick-Your-AI/pick-your-ai-research/issues/509",
          "relation": "Authorized literature-index scope and adjacent ownership"
        },
        {
          "title": "Organization contribution policy",
          "url": "https://github.com/Pick-Your-AI/.github/blob/main/CONTRIBUTING.md",
          "relation": "Team access, branch and independent review requirements"
        },
        {
          "title": "Canonical research method",
          "url": "https://github.com/Pick-Your-AI/pick-your-ai-research/blob/main/docs/RESEARCH_METHOD.md",
          "relation": "Cross-domain evidence policy; remains owned by research"
        }
      ],
      "remaining_gate": "The inferred scope is explicitly labeled and can be revised through ordinary reviewed planning changes; no missing user text is claimed.",
      "accepted_by": null,
      "acceptance_reference": null
    },
    {
      "id": "PAPER-DEC-002",
      "question": "What belongs in this repository?",
      "decision": "Own scholarly identities, metadata, original summaries, qualified claims and literature graph contracts. Link existing model, dataset, benchmark, pipeline and website owners.",
      "alternatives": [
        "Duplicate technical component catalogs",
        "Build a separate website and ingestion platform"
      ],
      "status": "Engineering Baseline Adopted",
      "decision_role": "Program maintainer and affected receiving owner",
      "rationale": "Preserve traceability, existing ownership and explicit unknowns while providing a concrete implementation/research foundation.",
      "affects": [
        "PAPER-01.02",
        "PAPER-09.07",
        "PAPER-15.01",
        "PAPER-17.01"
      ],
      "evidence": [
        {
          "title": "Parent coverage audit #509",
          "url": "https://github.com/Pick-Your-AI/pick-your-ai-research/issues/509",
          "relation": "Authorized literature-index scope and adjacent ownership"
        },
        {
          "title": "Organization contribution policy",
          "url": "https://github.com/Pick-Your-AI/.github/blob/main/CONTRIBUTING.md",
          "relation": "Team access, branch and independent review requirements"
        },
        {
          "title": "Canonical research method",
          "url": "https://github.com/Pick-Your-AI/pick-your-ai-research/blob/main/docs/RESEARCH_METHOD.md",
          "relation": "Cross-domain evidence policy; remains owned by research"
        }
      ],
      "remaining_gate": "Independent organizational/receiving acceptance remains separate from preparation.",
      "accepted_by": null,
      "acceptance_reference": null
    },
    {
      "id": "PAPER-DEC-003",
      "question": "What is the hierarchy and tracking model?",
      "decision": "Create native Program/Epic/Work Package issues for independently reviewable outcomes; keep 432 tasks and 864 subtasks as nested checklists. Stable PAPER identifiers are separate from actual GitHub numbers.",
      "alternatives": [
        "Create a native issue for every small subtask",
        "Use checkbox links as a substitute for native parent relations"
      ],
      "status": "Engineering Baseline Adopted",
      "decision_role": "Program maintainer and affected receiving owner",
      "rationale": "Preserve traceability, existing ownership and explicit unknowns while providing a concrete implementation/research foundation.",
      "affects": [
        "PAPER-19.01",
        "PAPER-19.06"
      ],
      "evidence": [
        {
          "title": "Parent coverage audit #509",
          "url": "https://github.com/Pick-Your-AI/pick-your-ai-research/issues/509",
          "relation": "Authorized literature-index scope and adjacent ownership"
        },
        {
          "title": "Organization contribution policy",
          "url": "https://github.com/Pick-Your-AI/.github/blob/main/CONTRIBUTING.md",
          "relation": "Team access, branch and independent review requirements"
        },
        {
          "title": "Canonical research method",
          "url": "https://github.com/Pick-Your-AI/pick-your-ai-research/blob/main/docs/RESEARCH_METHOD.md",
          "relation": "Cross-domain evidence policy; remains owned by research"
        }
      ],
      "remaining_gate": "Independent organizational/receiving acceptance remains separate from preparation.",
      "accepted_by": null,
      "acceptance_reference": null
    },
    {
      "id": "PAPER-DEC-004",
      "question": "How is ownership represented?",
      "decision": "Native GitHub Assignees are authoritative; initial work stays unassigned until accepted. Preserve existing team access policy and actual maintainer authority.",
      "alternatives": [
        "Assign all visible members by implication",
        "Create a custom Owner field and override existing teams"
      ],
      "status": "Engineering Baseline Adopted",
      "decision_role": "Program maintainer and affected receiving owner",
      "rationale": "Preserve traceability, existing ownership and explicit unknowns while providing a concrete implementation/research foundation.",
      "affects": [
        "PAPER-01.08",
        "PAPER-14.01",
        "PAPER-19.01"
      ],
      "evidence": [
        {
          "title": "Parent coverage audit #509",
          "url": "https://github.com/Pick-Your-AI/pick-your-ai-research/issues/509",
          "relation": "Authorized literature-index scope and adjacent ownership"
        },
        {
          "title": "Organization contribution policy",
          "url": "https://github.com/Pick-Your-AI/.github/blob/main/CONTRIBUTING.md",
          "relation": "Team access, branch and independent review requirements"
        },
        {
          "title": "Canonical research method",
          "url": "https://github.com/Pick-Your-AI/pick-your-ai-research/blob/main/docs/RESEARCH_METHOD.md",
          "relation": "Cross-domain evidence policy; remains owned by research"
        }
      ],
      "remaining_gate": "Independent organizational/receiving acceptance remains separate from preparation.",
      "accepted_by": null,
      "acceptance_reference": null
    },
    {
      "id": "PAPER-DEC-005",
      "question": "Can scientific status be inferred from planning progress?",
      "decision": "Keep work Status/Readiness/Acceptance separate from citation, reproduction, source-rights and publication states. Aggregate planning records use Publication Status Not Applicable.",
      "alternatives": [
        "Treat Done as verified scientific truth",
        "Treat source inspection as independent reproduction"
      ],
      "status": "Engineering Baseline Adopted",
      "decision_role": "Program maintainer and affected receiving owner",
      "rationale": "Preserve traceability, existing ownership and explicit unknowns while providing a concrete implementation/research foundation.",
      "affects": [
        "PAPER-01.06",
        "PAPER-07.01",
        "PAPER-10.01"
      ],
      "evidence": [
        {
          "title": "Parent coverage audit #509",
          "url": "https://github.com/Pick-Your-AI/pick-your-ai-research/issues/509",
          "relation": "Authorized literature-index scope and adjacent ownership"
        },
        {
          "title": "Organization contribution policy",
          "url": "https://github.com/Pick-Your-AI/.github/blob/main/CONTRIBUTING.md",
          "relation": "Team access, branch and independent review requirements"
        },
        {
          "title": "Canonical research method",
          "url": "https://github.com/Pick-Your-AI/pick-your-ai-research/blob/main/docs/RESEARCH_METHOD.md",
          "relation": "Cross-domain evidence policy; remains owned by research"
        }
      ],
      "remaining_gate": "Independent organizational/receiving acceptance remains separate from preparation.",
      "accepted_by": null,
      "acceptance_reference": null
    },
    {
      "id": "PAPER-DEC-006",
      "question": "Which content is safe to commit initially?",
      "decision": "Use original planning, scholarly metadata proposals and permitted links. Exclude copied abstracts/figures/full text, private datasets, weights and credentials unless a specific future use is separately cleared.",
      "alternatives": [
        "Assume open access permits redistribution",
        "Apply the repository license to all third-party source material"
      ],
      "status": "Policy Baseline Adopted; Per-source Decisions Pending",
      "decision_role": "Program maintainer and affected receiving owner",
      "rationale": "Preserve traceability, existing ownership and explicit unknowns while providing a concrete implementation/research foundation.",
      "affects": [